{
  "version": 1,
  "roles": [
    "orchestrator",
    "lifecycle-stage",
    "policy",
    "primary-executor",
    "modifier",
    "quality-gate",
    "handoff",
    "runtime"
  ],
  "capabilities": [
    "agent-native-imagegen",
    "ant-design",
    "browser",
    "codex-security",
    "creative-production",
    "external-agent",
    "imagegen",
    "isolated-thread",
    "mcp-imagegen",
    "playwright",
    "product-design",
    "shadcn",
    "subagent",
    "trusted-cli",
    "visual-work",
    "web-data-visualization"
  ],
  "skills": {
    "ric-delivery-loop": {
      "description": "Use when delivering a non-trivial feature, fix, redesign, migration, or system change that requires coordinated requirements, design, implementation, review, testing, validation, and evidence.",
      "allowed_roles": [
        "orchestrator"
      ],
      "default_role": "orchestrator",
      "domains": [
        "delivery-lifecycle"
      ],
      "required_companions": [
        "ric-agent-operating-rules",
        "ric-requirements-engineering",
        "ric-solution-design",
        "ric-independent-review",
        "ric-code-review",
        "ric-security-review",
        "ric-testing-quality",
        "ric-acceptance-validation"
      ],
      "optional_companions": [
        "ric-visual-design-review",
        "ric-design-qa",
        "ric-docs",
        "ric-deployment-ops"
      ],
      "conflicts": [],
      "quality_gates": [
        "ric-independent-review",
        "ric-code-review",
        "ric-security-review",
        "ric-testing-quality",
        "ric-acceptance-validation"
      ],
      "capability_routes": [
        "subagent",
        "isolated-thread",
        "external-agent"
      ]
    },
    "ric-requirements-engineering": {
      "description": "Use when a non-trivial request has ambiguous scope, unstated constraints, missing acceptance criteria, competing stakeholder needs, or requires a reviewable requirements baseline.",
      "allowed_roles": [
        "lifecycle-stage"
      ],
      "default_role": "lifecycle-stage",
      "domains": [
        "requirements"
      ],
      "required_companions": [
        "ric-independent-review",
        "ric-security-review"
      ],
      "optional_companions": [],
      "conflicts": [],
      "quality_gates": [
        "ric-independent-review",
        "ric-security-review"
      ],
      "capability_routes": []
    },
    "ric-solution-design": {
      "description": "Use when approved requirements need an implementation-ready product, architecture, data, API, visual, operational, or migration design before coding begins.",
      "allowed_roles": [
        "lifecycle-stage"
      ],
      "default_role": "lifecycle-stage",
      "domains": [
        "solution-design",
        "product-design"
      ],
      "required_companions": [
        "ric-independent-review",
        "ric-security-review"
      ],
      "optional_companions": [
        "ric-visual-design-review",
        "ric-design-qa"
      ],
      "conflicts": [],
      "quality_gates": [
        "ric-independent-review",
        "ric-security-review"
      ],
      "capability_routes": [
        "creative-production",
        "product-design",
        "web-data-visualization"
      ]
    },
    "ric-independent-review": {
      "description": "Use when requirements, designs, code, tests, evidence, or release decisions need a read-only fresh-context reviewer who is independent from the artifact author or fixer.",
      "allowed_roles": [
        "quality-gate"
      ],
      "default_role": "quality-gate",
      "domains": [
        "review"
      ],
      "required_companions": [],
      "optional_companions": [],
      "conflicts": [],
      "quality_gates": [],
      "capability_routes": [
        "subagent",
        "isolated-thread",
        "external-agent"
      ],
      "gate_types": [
        "requirements",
        "design"
      ]
    },
    "ric-security-review": {
      "description": "Use when a non-trivial change touches code, data, authentication, authorization, tenants, secrets, dependencies, infrastructure, integrations, deployment, or any user-controlled input.",
      "allowed_roles": [
        "quality-gate"
      ],
      "default_role": "quality-gate",
      "domains": [
        "security"
      ],
      "required_companions": [
        "ric-independent-review"
      ],
      "optional_companions": [
        "ric-infra-safety"
      ],
      "conflicts": [],
      "quality_gates": [],
      "capability_routes": [
        "codex-security"
      ],
      "gate_types": [
        "security-review"
      ]
    },
    "ric-acceptance-validation": {
      "description": "Use when a tested integrated revision must be independently validated against approved acceptance criteria before final delivery or release readiness.",
      "allowed_roles": [
        "quality-gate"
      ],
      "default_role": "quality-gate",
      "domains": [
        "acceptance",
        "browser-interaction"
      ],
      "required_companions": [
        "ric-independent-review"
      ],
      "optional_companions": [],
      "conflicts": [],
      "quality_gates": [],
      "capability_routes": [
        "browser",
        "playwright",
        "external-agent"
      ],
      "gate_types": [
        "acceptance"
      ]
    },
    "ric-visual-design-review": {
      "description": "Use when a UI, portal, admin console, redesign, brand surface, generated asset set, or visual implementation needs an independent critique of quality, specificity, hierarchy, and distinctiveness.",
      "allowed_roles": [
        "quality-gate"
      ],
      "default_role": "quality-gate",
      "domains": [
        "visual-review"
      ],
      "required_companions": [
        "ric-independent-review"
      ],
      "optional_companions": [],
      "conflicts": [],
      "quality_gates": [],
      "capability_routes": [
        "product-design",
        "creative-production"
      ],
      "gate_types": [
        "visual-review"
      ]
    },
    "ric-design-qa": {
      "description": "Use when a rendered UI or generated asset implementation must be compared with an approved design, screenshot, reference image, direction board, or source-of-truth visual target.",
      "allowed_roles": [
        "quality-gate"
      ],
      "default_role": "quality-gate",
      "domains": [
        "design-qa"
      ],
      "required_companions": [
        "ric-independent-review"
      ],
      "optional_companions": [],
      "conflicts": [],
      "quality_gates": [],
      "capability_routes": [
        "browser",
        "product-design"
      ],
      "gate_types": [
        "design-qa"
      ]
    },
    "ric-skill-quality": {
      "description": "Use when creating, editing, reviewing, packaging, or releasing skills and the repository needs structural checks, trigger evaluation, conflict detection, behavioral scenarios, or independent quality evidence.",
      "allowed_roles": [
        "quality-gate"
      ],
      "default_role": "quality-gate",
      "domains": [
        "skill-authoring"
      ],
      "required_companions": [
        "ric-independent-review"
      ],
      "optional_companions": [],
      "conflicts": [],
      "quality_gates": [],
      "capability_routes": [
        "subagent",
        "isolated-thread",
        "external-agent"
      ],
      "gate_types": [
        "skill-quality"
      ]
    },
    "ric-imagegen-runtime": {
      "description": "Use when generated or edited raster assets are required in an environment where ImageGen capabilities, providers, credentials, or output paths may vary.",
      "allowed_roles": [
        "runtime",
        "policy"
      ],
      "default_role": "runtime",
      "domains": [
        "image-generation"
      ],
      "required_companions": [],
      "optional_companions": [],
      "conflicts": [],
      "quality_gates": [],
      "capability_routes": [
        "agent-native-imagegen",
        "mcp-imagegen",
        "trusted-cli"
      ]
    },
    "ric-agent-operating-rules": {
      "description": "Use when performing any task in a RIC workspace or when repository work must preserve user changes, follow the configured Windows runtime, and apply RIC safety constraints.",
      "allowed_roles": [
        "policy"
      ],
      "default_role": "policy",
      "domains": [
        "agent-policy"
      ],
      "required_companions": [],
      "optional_companions": [],
      "conflicts": [],
      "quality_gates": [],
      "capability_routes": []
    },
    "ric-infra-safety": {
      "description": "Use when work may read or modify databases, migrations, caches, queues, search indices, streams, object storage, shared services, credentials, or infrastructure provisioning.",
      "allowed_roles": [
        "policy",
        "primary-executor"
      ],
      "default_role": "policy",
      "domains": [
        "infrastructure",
        "data-safety"
      ],
      "required_companions": [
        "ric-security-review"
      ],
      "optional_companions": [],
      "conflicts": [],
      "quality_gates": [
        "ric-security-review"
      ],
      "capability_routes": []
    },
    "ric-node-pnpm": {
      "description": "Use when a task changes Node.js versions, JavaScript or TypeScript dependencies, package-manager state, workspace scripts, lockfiles, or pnpm monorepo configuration.",
      "allowed_roles": [
        "policy",
        "primary-executor"
      ],
      "default_role": "policy",
      "domains": [
        "node",
        "package-management"
      ],
      "required_companions": [],
      "optional_companions": [],
      "conflicts": [],
      "quality_gates": [],
      "capability_routes": []
    },
    "ric-admin-console": {